id,new,title,description,summary,keywords,platforms,copying-policy,sha
recover,,RECOVER,"Stellt Disks/verlorene Dateien wieder her.","RECOVER stellt Disks oderverlorene Dateien wieder her.","Datenrettung, recover, disks, files","DOS, FreeDOS","GNU General Public License, Version 2",16b93e7b6f9ade82162a05ef57e129e0b2189e8c0b2b8558068412710f9dbd4a
regina,,"Regina REXX","Port des Regina Rexx Interpreters.","Port des Regina Rexx Interpreters mit SAA Rexx API Support.","Regina, REXX",DOS,"GNU Library General Public License, Version 2",76bb71de0a02f49a04119133421ed703c70b30ef4adf809ae54e554835c2666e
replace,,REPLACE,"Ersetzt Dateien in einem Zielverzeichnis.","Ersetzt Dateien im Zielverzeichnis durch gleichnamige Dateien aus dem Quellverzeichnis.","copy, replace, ersetzen","DOS, FreeDOS","GNU General Public License, Version 2",da41f768f4f5eb789a2744672f5b22a3317cc15e421fd03748bb6f48bb560f7d
rerror,,Rerror,"Stderr/stdout-Ausgaben speichern.","Erfasst stderr- und stdout-Ausgaben von Programmen und speichert sie in einer Datei.","stderr, stdout, capture, output","DOS (Micro-C)",Free,0000000000000000000000000000000000000000000000000000000000000000
ripcord,,RIPCORD,"Versionsinformation zu jedem Programm.","Gibt Versionsinformationen zu jedem Programm in dieser Distribution an.","FreeDOS, DOS, ripcord Version program number","DOS, FreeDOS","Public Domain",8441c025251ca72b8079b69559fa4ed545bc9014be3e2f8c85282e75ce3f780f
romdsk,,ROMDSK,"Toolkit mit dem DOS von einem ROM booten kann.","ROM Disk ToolKit um einen DOS Kernel aus einem ROM (EPROM, Flash) zu starten.","ROM, disk, EPROM, flash, EEPROM, DOS, FreeDOS, kernel, boot, INT19H","DOS (TASMB), FreeDOS","GNU General Public License, Version 2",56c64c9311b0007951d98d7d6cea6994017f54743dcf5cd006d979eeb92ee918
romos,,ROMOS,"Bootet von externen ROM oder SystemBIOS ohne Disks.","ROMOS kann FreeDOS aus einem externen ROM oder dem System-BIOS des Rechner ohne Disks starten.","ROM, BIOS, Flash, ISA, ROM module, DOS, NASM, AWARD, HOTFLASH,CPUID,microcode","OS unabhÑngiger x86 Code (verwenden Sie NASM Compiler)","GNU General Public License, Version 2",7446dc610875a936fb1f84d5f3d999e7ab4bc5a53c8f858d3b0787d9b3a610bd
row4,,"Four in a row","Vertikales Brettspiel.","Ein vertikales Brettspiel.","games, Spiele","GNU/Linux, DOS (bcc), Windows, Web (CGI)","GNU Affero General Public License, version 3 or later",4355f335cbe07ba345931c3926b2ef8b2406f6f57c238e1961bbafc426686610
rsync,,rsync,"Synchronisiert Dateien und Verzeichnisse.","Rsync ist ein Tool zum Synchronisieren von Dateien und Verzeichnissen von einem Ort zum anderen. Im Delta-Verfahren wird Bandbreite gespart. Dieser rsync port ist nur ein Teil des vollen rsync, teilweise wegen Speicherlimitierungen und Limitierungen die DOS mit sich bringt. Diese Implementierung bringt keinen Server, keinen rsh/ssh Support, Dateinamen auf dem Server mÅssen im DOS Format sein und Komprimierung fehlt auch.",rsync,DOS,"GNU General Public License, Version 2",577c372b114f079bce4cf321c08067f1d3b30d27728ba923d9c15232a8cc5e13
runtime,,runtime,"Misst die ProgrammausfÅhrungszeit.","Misst die ProgrammausfÅhrungszeit und teilt Ihnen dessen Laufzeit mit.","DOS, run, time, timer","DOS (Borland C) **benîtigt Cats (GNU LGPL)","GNU General Public License",e556e207ec6e2ef8843162f843a3c61fa401cda5ca08309ca954951a095b7f5f
samcfg,,SAMCFG,"Beispiele von Konfigurationsdateien.","Sammlung von Beispielen zum Erstellen von C:\CONFIG.SYS und C:\AUTOEXEC.BAT Konfigurationsdateien aus frÅheren FreeDOS-Versionen.","FreeDOS, sample, configuration, config.sys, autoexec.bat, batch, script, Beispiel","DOS, FreeDOS","Public domain",04861adbfafb0d33e3f17aa427ee7f20f5a35906b22f99f4b656f3ff272c9ea6
sayswho,,SaysWho,"Ein einfaches GedÑchtnisspiel.","Eine einfaches GedÑchtnisspiel (Erfordert einen 386+, PC Lautsprecher wird empfohlen).","DOS, Spiel",DOS,"BSD 3-Clause Lizenz",0000000000000000000000000000000000000000000000000000000000000000
sbmix,,SBMix,"SB Pro u.Ñ. Mischereinst. anzeigen/Ñndern.","SBMIX ist ein kleines Programm zum Anzeigen und éndern von SoundBlaster Pro (und kompatiblen) Mixereinstellungen, d. h. Master-, Wave-, FM-, CD-, Line- und Mic-LautstÑrken, direkt Åber die DOS-Befehlszeile. Bei einigen Karten kann es erforderlich sein, unter normalem DOS irgendetwas zu hîren, da einige Karten mit Null-LautstÑrke initialisiert werden.","DOS, sound blaster, audio, volume, Soundblaster Pro",DOS,"'Modified' BSD License",9ed8ef8c98667244e1ac9bb88cefa8c59bc4661937f6e192671ac247f515a2ee
sdwrgmpd,*,"SideWinder GamePad Driver","SideWinder GamePad in DOS verwenden.","Verwenden Sie Ihr Microsoft SideWinder GamePad in DOS.","DOS, games, Spiele",DOS,"Freeware, see documentation",8a7bc3a0449fcfff7e51bbf50d92050a51aea74897900fc73e899fc68b757ef0
seal,,SEAL,"Eine 32 Bit grafische BenutzeroberflÑche.","SEAL ist eine grafische 32 Bit BenutzeroberflÑche (GUI) fÅr DOS. Es hat einige fortgeschrittene Features, wie z.B. ein dynamisches Linkersystem (XDL), Sound und andere Multimediafunktionen und ist mehrsprachig.","SEALl, GUI, FreeDOS, DOS, grafische BenutzeroberflÑche","FreeDOS, DOS","GNU General Public License, Version 2",230780f41fd5846bfed15b07dca0fd27efd3322d64128689c9612a28137b16b5
search,,Search,"Findet Dateien auf dem Computer.","Findet Dateien auf dem Computer.","FreeDOS, search, Suche",DOS,"GNU General Public License, Version 2",edea9aa8b12ba9e01b3fba45a10e3604683047d00b0368d26ad918b1ab2f9559
senet,,Senet,"Sehr altes Spiel aus dem alten égypten.","Senet ist ein sehr altes Spiel, das bis ins alte égypten zurÅckreicht. Da es so alt ist und niemand im alten égypten die Regeln fÅr spÑtere Generationen aufbewahrt hat, sind die genauen Regeln ein RÑtsel. Historiker haben versucht, die Regeln von Senet herauszufinden, aber sie sind sich in Details nicht einig.","Games, Spiele",DOS,"GNU General Public License, Version 2",588aed8e23387ac2b40e63e2801125fea9525ac9dfdaba31802ed04de3d41df6
serilmon,*,Serial,"öberwacht Status der seriellen COM-Ports.","TSR zur öberwachung des aktuellen Status der seriellen COM-Ports.","DOS, games, Spiele",DOS,"Freeware, see documentation",3dccdcdb1d79efff3f7e2096dde5382b9f4bc9b0d6cf9322ce8e866d9478e066
setedit,,setedit,"Programmier-Editor fÅr DJGPP.","Setedit ist ein freundlicher Konsolen-Texteditor mit dem Look-And-Feel des Borland Editors fÅr DOS. (Anmerkung: setedit funktioniert nicht unter DOSBOX)","editor, unicode, DJGPP",DOS,"GNU General Public License, Version 2",0b9e40c1ded9af0e56caec6ddd5480ba531020a90be05620b4e8bc581f80f3f3
setlock,,SetLock,"Caps, Num und Scroll Lock Tasten festlegen.","Caps, Num und Scroll Lock Tasten per Software festlegen.","lock, caps, num, scroll, set","DOS, FreeDOS","GNU General Public License, Version 2",f8e5170eb5942f428a9797efc7e2a9872e80506189382ed2b74d146a07d56820
share,,SHARE,"File-Sharing und Sperren von Dateien.","Installiert Dateifreigabe- und Sperrfunktionen auf Ihrer Festplatte - nur fÅr den FreeDOS-Kernel.","share, file sharing",FreeDOS,"GNU General Public License",3c1218e3885cd59890acaee791273d20b4ef437ac6218ae5488e4fd4473ea5d8
shareext,,shext,"Share Extender.","Share Extender.","share extension","DOS, FreeDOS","GNU General Public License, Version 2",11bc5c05de37564e4e842a514235eb1ed12caab17e5a5d45331f10299bfae890
shsucd,,"SHSUCD Suite","Programme, die sich mit CD-ROM befassen.","Die SHSUCD-Suite ist eine Reihe von Programmen, die sich mit der CD-ROM befassen. Sie ermîglichen den Zugriff auf die CD-ROM als normalen Laufwerksbuchstaben, erstellen eine Image-Datei aus dem Inhalt einer CD-ROM, greifen auf eine Image-Datei als Laufwerk zu und testen bestimmte CD-ROM-Funktionen. SHSUCDX-BinÑrdateien sind in diesem Paket nicht enthalten, um keinen Konflikt mit dem SHSUCDX-Paket zu verursachen.","mscdex, shsucdex, fdcdex, cdrom, atapicdd, xcdrom, shsucdx, shsucdhd, shsucdrd, shsudvhd, shsucdri, omi, isobar, cdtest, smarter","DOS (NASM), FreeDOS","Open Source (copyright reserved, free use program)",4df00f8ce6f643dd19a8c9177a147eb397d0d2629c42d881ed89dd63a9b8d9ab
shsucdx,,SHSUCDX,"CD-ROM und DVD-ROM Extender.","CD-ROM und DVD-ROM Extender.","mscdex, shsucdex, fdcdex, cdrom, atapicdd, xcdrom","DOS (NASM), FreeDOS","Open Source (copyright reserved, free use program)",a38290990cc82253090d53b6af7c00f2868d95bb89d11e8862bbdaf98739e755
shsufdrv,,SHSUFDRV,"Treiber fÅr Disketten-/Festplattenimages.","SHSUFDRV ist ein Treiber fÅr Floppy- und Festplattenimages (z.B.: ISO). SHSURDRV kopiert ein Image in den Arbeitsspeicher und/oder erstellt Ramdrives.","Treiber, driver, floppy, images, hard disk, ram drive","DOS, FreeDOS","Freeware / source code available",6d7dbad861a8068bacca6e71711b069418b4b91cd7ce6df76dce6d34f02c4fa6
simcoupe,,SimCoupe,"Ein SAM Coupe Emulator.","Ein SAM Coupe Emulator.","sam, coupe, Dmulator","DOS, Windows, MacOS X, GNU/Linux, Windows Mobile, BeOS, QNX, OS/2, AmigaOS, PlayStation Portable, GP2X","GNU General Public License, Version 2",b95d400f7ad73a05ca31a70757c705d2f76f832a2ea5d43b0508b282c794f7af
sleep,,sleep,"Tool, Ñhnlich dem Unix-Tool ""sleep"".","Sleep ist dem gleichnamigen UNIX-Tool Ñhnlich. Sleep kann die AusfÅhrung von Batchdateien fÅr eine bestimmte Zeit pausieren. Sleep gibt an Betriebssysteme, die dies unterstÅtzen, Zeitscheiben ab. Sleep erkennt und berÅcksichtigt auch den DOS-Switchar.","Erweiterung, extension, utility, sleep","DOS, FreeDOS","GNU General Public License, Version 2",7e2794fbeca3a4eb2172050a2d0baeea8f437648663d08aee1e2578e65e87261
slicer,,"File Slicer",Archiv-/Datei-Slicing/Spanningprogramm.,"Ein einfaches Archivierungsdienstprogramm (kein Dateikomprimierungsprogramm) zum Kategorisieren und Splitten gro·er Dateien und Verzeichnisse auf kleinere Medien. Es erfordert einen 8086 mit EGA oder besserer Grafik. (UPX-komprimiert)","dos 16 bit file archive span split slice",DOS,"Simplified (2-Clause) BSD License",4485f4a7716065be8588d46ebf6dfbce0977769e24e44f8b5b6dd75a476444bd
slowdown,,SLOWDOWN,"Verlangsamt einen schnellen Computer.","Verlangsamt einen schnellen Computer. Die Geschwindigkeit ist vollstÑndig Åber die Befehlszeile oder Åber Hotkeys konfigurierbar. Bietet verschiedene Methoden oder Modi um den Computer langsamer zu machen.","slowdown speed, DOS,",DOS,"Freeware, see documentation",ad4f6138b99f7e5c281128eb0babaebb1c57ca35fb3e93a31e6abadcc96152f8
smallbas,,SmallBASIC,"Kleiner BASIC Interpreter.","Kleiner BASIC Interpreter.","Freedos, Basic","PalmOS, VTOS, Franklin's, Linux, Win32, DOS","GNU GPL",0000000000000000000000000000000000000000000000000000000000000000
smiley,,Smiley,"Ein einfaches Spiel im Stil von Pong.","Ein einfaches Spiel im Stil von Pong, hauptsÑchlich zum Testen verschiedener Aspekte der Inferno Game Engine. Erfordert VGA und 386+. Eine Maus wird dringend empfohlen.","DOS, games, Spiele",DOS,"BSD 3-Clause License",298b004fca325f2efdf88c3914ba428353515fb76ae5032e1b9645ef72812785
sneese,,SNEeSe,"Super NintEndo Entertainment Systememulator.","SNEeSe ist ein Super NintEndo Entertainment Systememulator.","Nintendo, Emulator, games, Spiele","DOS, Windows, GNU/Linux, Unix, BeOS","Clarified Artistic License",9b9f4624685e10f269d3f4f1153ddc91cf4d9dee18f7fa701fcee83409b0f9cf
snova,,Supernova,"Zukunfts-Adventure Spieleset, textbasiert.","Textbasiertes Adventure Spieleset, welches in der Zukunft spielt.","games, Spiele",DOS,"GNU General Public License, Version 2",3083f97f835d1a018e1af82832843362c981a19ef9ce2ac3f53db0d6883146b6
sort,,sort,"Sortiert den Inhalt einer Textdatei.","Sortiert den Inhalt einer Textdatei, optional mit der NLS-Vergleichstabelle.","sort, text, file, Textdatei, sortieren","DOS (z.B. Borland Turbo C), enthÑlt eigene KITTEN Bibliotheksversion, FreeDOS","GNU General Public License, Version 2",a186099808deaa4982b46efcf960b41d4934a87778e3f3a7f869578a10dc513a
spool,,Spool,"Druckt im Hintergrund.","Druckt im Hintergrund. Braucht das DOS-Tool PRINT nicht.","print, spool, spooler","DOS, FreeDOS","Public Domain",45fda35027d78508d7530d7feaebd9151c7a4e9fae5d5291a83b80a844fa3b8a
sqlite,,SQLite,"Eine integrierbare SQL Datenbank Engine.","Eine integrierbare SQL Datenbank Engine.","sql, sqlite",DOS,"Public Domain",3db72ed983fc7ac75a8da8bc305436a9e189fe4ef764b750ffb6e3c1a8fdf26f
srdisk,,"SRDISK (resizeable RAM disk)","Grî·enverÑnderbare RAMdisk.","Grî·enverÑnderbare RAMdisk. SRDISK ist schnell und kann mit mehr als 32MB XMS und EMS Speicher umgehen. Die Grî·e kann ohne Neustart oder Datenverlust geÑndert werden. Diskcopy kompatibel.","extension, utility, ramdisk","DOS, FreeDOS","GNU General Public License, Version 2",2b2abf288ff6038a8941e4f3ff454c138d4a9b6fba057a853b2d9a0b858cca54
ssh2dos,,SSH2DOS,"SSH Client fÅr das SSH Protokoll v. 2.0.","SSH Client fÅr das SSH Protokoll v. 2.0. EnthÑlt au·erdem SCP, SFTP und telnet in 8086 und 80386 Versionen.","ssh protocol network communication remote access, Netzwerkkommunikation, Fernzugriff","DOS (OpenWatcom 1.x)","GNU General Public License, Version 2",3227e40de55096e230d326c353fd6d408299da03d05d543654f003bd2da09c83
sshdos,,SSHDOS,"SSH Client fÅr DOS. ","SSH Client fÅr DOS. EnthÑlt au·erdem SSH, SCP und SFTP in 8086 und 80386 Versionen.","ssh protocol network communication remote access, Netzwerkkommunikation, Fernzugriff","DOS (Borland C 3.1, DJGPP 2.03)","GNU General Public License, Version 2",459e6b2576d69aede1c631d2b29aef58b4db5dfe275564d2e4662ba29fbc5d8c
stamp,,stamp,"Setzen/Lesen/Filtern von Dateizeitstempeln.","Setzen/Lesen/Filtern von Dateizeitstempeln.","FreeDOS, file, Datei, timestamp, Zeitstempel","DOS, FreeDOS","GNU General Public License, Version 2",ec61f8d4411c85cd42b9daa429dfb9adf2629e73e354b0581fba82759b2d3901
start,,Start,"Startet ein FreeDOS Programm.","Startet ein FreeDOS Programm.","start, launch","DOS, FreeDOS","Express Software Public License, Version 1",f897c3e6896ec3ecad3e4a6788f4de30f2587165fe7c1ccf41c89fa376944c9c
sudoku86,,sudoku86,"Sudoku Spiel fÅr DOS auf 8086/8088 CPUs.","Ein 16bit Sudoku Spiel fÅr DOS auf 8086/8088 CPUs.","Sudoku, games, Spiele",DOS,"Simplified (2-Clause) BSD License",d785b983ea2a051dee75dd5e2a2386945148fc31c162753fab8ebfcd096afd39
suppls,,"SUPPL (lib)","Grosse Bibliothek mit nÅtzlichen Funktionen.","Eine ganze Bibliothek nÅtzlicher Funktionen, darunter:| * Syslog-Subsystem * INI-Datei-Direktzugriffs-Subsystem:| * sichere String-Funktionen * Befehlszeilen-Parser| * NLS-Informationsanbieter| * VollstÑndige Beschreibung unter:| * http://www2.inf.fh -rhein-sieg.de/~skaise2a/ska/sources.html#suppl| * Die Vorabversionen werden derzeit nur mit Borland C v5.2 kompiliert.","Bibliothek c, programming, library, supplemental, Programmierung",DOS,"GNU General Public License, Version 2",6dc08dee23d5670cc9410a55695744b3f133367a45ea2a76ea26d83d90c8f1d3
svarcom,*,SvarCOM,"Der SvarDOS-Befehlszeileninterpreter.","SvarCOM ist der SvarDOS-Befehlszeileninterpreter. Es ist ein Programm in der Entwicklung. Obwohl es funktionsfÑhig ist, ist es weder vollstÑndig ausgefeilt noch vollstÑndig und wird als ""Vorschau""-Version betrachtet.","command, shell, freecom",DOS,"MIT License",ddebcd6bef9209e480bf79855a1427026442b325e6afac9fca801c62d52a069e
switchar,,switchar,"Anzeigen und Einstellen des DOS Switchar.","Anzeigen und Einstellen des DOS Switchar.",FreeDOS,"DOS, FreeDOS","GNU General Public License, Version 2",65a765d320ad9e7971bc98457973f1a0fe3d9ac71f865cf1efcb6818e74faada
swsubst,,swsubst,"SUBST und JOIN.","SUBST und JOIN.","FreeDOS, subst, join",DOS,"GNU General Public License, Version 2",6630f3f9dac07407f055b473ea0b8a77e4fc2a54c9185e1fe774d7e8162dd242
syslnx,,Syslinux,"Die Syslinux Bootloader Sammlung.","Die Syslinux Bootloader Sammlung.","eltorito, syslinux, memdisk, isolinux, module chain",FreeDOS,"GNU General Public License, Version 2",1134d9ac24a9f2493ba1942c16ed83ef3f3ac0d46ddfc9983eae8bf1c40ce65e
tail,,tail,"Zeigt hinteren Teil einer Datei an, Ñhnlich UNIX 'tail'.","Zeigt den hinteren Teil einer Datei an. éhnlich wie UNIX 'tail'.","tail, Unix, file, Datei","DOS, FreeDOS","Open Source",34767ee1deb7e9eb819428ec3b6e7d3adad3d78bc89f3fbe77fd4f15baa73ca9
tar,,"TAR (GNU TAR)","Ein Bandarchivierer.","Ein Bandarchivierer.","archiver, tape, Band,","DOS, FreeDOS","GNU General Public License, Version 2",95494ea8f8d7e0c1474b749f5af9b58e80b59097f5d273118cae55c23f2f1bc7
tde,,"TDE (Thomson-Davis Editor)","Einfacher BinÑr-/Textdateieditor.","TDE ist ein einfacher, public-domain Multi-Datei und Multi-Fenster Editor fÅr Text- und BinÑr-Dateien. Entwickelt fÅr IBM PCs und Klone mit DOS und Win32 Konsole.","edit, Editor, Text","DOS, FreeDOS, Win32 (console) Linux","Public Domain",ff136bfd6a5c62237bbaa9424602a8caa7f9a8fbb9c7b2cb920512c7fecb0724
tdsk,*,"tdsk (RAM disk)","Turbodisk RAM Disk Treiber.","Turbodisk RAM Disk Treiber. Erstellt ein RAMdrive (sehr schnelles virtuelles Laufwerk, welches den Arbeitsspeicher nutzt).","freedos, ramdrive","dos (ASM)","public domain",037a82589e765a7ed4fb679eb911673c1784e1d53f0f125bdcca9beaeba376a4
tee,,TEE,"Speichert eine Kopie seines Inputs in einer Datei.","Speichert eine Kopie seines Inputs in einer Datei wÑhrend es eine Kopie nach stdout ausgibt.","tee, unix","DOS (OpenWatcom C), FreeDOS","GNU General Public License, Version 2",6b8d0150a1b569fdc284b727b7fb0426a0bb124d337379ad0235b5674f673b1d
teo,,Teo,"Emulator des Thomson TO8 Microcomputers.","Ein Emulator des Thomson TO8 Microcomputers.","Thomson, Emulation",DOS,"Free with restrictions, see License",15e8c5abe79d05f388edc35100cf9d9814f4c2bccf9a3754bccadda826f09aab
terminal,,terminal,"Ein kleines VT100/ANSI Terminal.","Ein kleines VT100/ANSI Terminal fÅr jeden PC.","terminal, rs-232, vt100","DOS (NASM)","GNU General Public License, Version 2",a52bd5d1bd161f59699cc831ffb7f58211012877066696071b376ff7a7c9a416
testdisk,,"Testdisk (and Photorec)","Checkt Partitionen/Bootsektoren von Disks.","Testdisk checkt Partitionen und Bootsektoren von DatentrÑgern. Photorec ist ein Tool um Daten verschiedenster Art zu retten.","testdisk, photorec, data, recover, test",DOS,"GNU General Public License, Version 2",3dac580be23d23490b6936e5ad6d2a6961b3244e84309d4fde393a6333d107e6
tetris2k,,SmallTetrris,"DOS Tetris, nur 2 KB gro·.","DOS Tetris, nur 2 KB gro·.","Tetris, games, Spiele","DOS, TASM 3.0","Free w/Sources",f203b81ab4e6fa1e79f12b132c9af30ed560a42f3b0cad0213284e536b82cfdc
tinyasm,,TinyASM,"Kleiner Assembler fÅr 8086/8088 Programme.","Tinyasm ist ein kleiner Assembler fÅr 8086/8088-Programme, der auf einem echten PC XT-Rechner arbeiten kann. Er erfordert mindestens 128 KB Arbeitsspeicher.","Assembler, asm",DOS,"Simplified (2-Clause) BSD License",15e13ac99560e593a02f90980320f6d91dd1b87b779cfadc0099309f057ac490
topspin,,topspin,"Ein MenÅ-Interpreter-Programm.","Ein MenÅ-Interpreter-Programm, welches dem Benutzer erlaubt, Umgebungen zu erstellen, wo es keine gibt.","menu, system, utility, MenÅ","DOS, FreeDOS","GNU General Public License, Version 2",09b0efdedbbeb99b85007915c9dfaa8d78b2f914f454a18864c54773d35d8242
touch,,TOUCH,"Setzen von Datum und Uhrzeit einer Datei.","Setzen von Datum und Uhrzeit einer Datei wie beim UNIX-Tool 'touch'.","touch, time stamp, unix, Datum, Zeit","DOS (2.0, 8086), FreeDOS","GNU General Public License, Version 2",d1742e0f5a465d4907812efbe58abdb8f5c36fed17c5ee4e5477855e3585ba25
tp7p5fix,*,"TP7/P5+ fix","TSR zum Beheben des RuntimeError 200 in Programmen","TSR zum Beheben des Runtime Error 200 in Turbo Pascal-Programmen zur Laufzeit, ohne dass ein Patch die ausfÅhrbare Datei patchen mu·.","DOS, games, Spiele",DOS,"GNU LIBRARY GENERAL PUBLIC LICENSE, Version 2",287115e9d5c36ece3ad74553fc62786599d162e3abb6902f8ccfe1ba44b9d926
tpasm,,TPASM,"Cross-Assembler fÅr 6805, 6809 u.v.a.","TPASM ist 'ein Unix-basierter Cross-Assembler fÅr 6805, 6809, 68HC11, 6502, Sunplus, 8051, Z80, PIC, AVR und c166.' Danke an dec_hl fÅr die Erstellung einer FreeDOS-Version (das Kompilieren der BinÑrdateien verwendet DJGPP, gcc Version 8.2.0; siehe Makefile.dj2). Dies ist ansonsten eine Kopie der offiziellen TPASM-Quellen von Todd Squires; Todd unterhÑlt TPASM noch immer, daher bittet dec_hl, dass Sie sich bei Assemblierungsfehlern oder Verbesserungen an Todd wenden.","mpasm, asm, assembler, assembly",DOS,"GNU General Public License, Version 2",b36f482276aefc8a465b56e7489fe892ccb55f8b7f1efa92ba728fc81d0ee547
tppatch,,TPPATCH,"Patchtool fÅr RUNTIME200 Bug in Turbo Pascal.","Patchtool fÅr den RUNTIME200 Bug in Programmen, die mit Turbo Pascal kompiliert wurden.","runtime, tp, Turbo Pascal",DOS,"Free, no sources",1fac9f5f4031e85a1eda138f21784d6f8f9715828e66e80b13e4f868c32f86c6
trch,,trch,"öbersetzt Zeichen","öbersetzt Zeichen. Dies war frÅher das Programm UNIX2DOS, aber das öbersetzen von Zeichen kann mehr. [éhnlich, aber nicht identisch mit UNIX 'tr'.] (enthÑlt Cats GNU LGPL).","trch, unix2dos, tr","DOS (Borland C), FreeDOS","GNU General Public License, Version 2",fd31f11591924492dd9bd07d779801cfd000992c627d5a787bd1a24d89504bc3
tree,,Tree,"Zeigt Ordnerstruktur eines Laufwerks/Pfads grafisch an.","Zeigt die Ordnerstruktur eines Laufwerks oder Pfads grafisch an. UnterstÅtzung fÅr Nachrichtenkataloge (verschiedene Sprachen) mit cats, kann sowohl fÅr Windows NT/9x als auch fÅr DOS kompiliert werden.","tree, FreeDOS, DOS, Win32","DOS (TC2, TC++1, TC30, BC31, BC45, MicroC v3*, Pacific C*, Digital Mars),","GNU General Public License, Version 2",e632d08027ef1fbcfc87787de3ead1be39a761c28801bb8c3b5c5b6860b53f6a
ttf2fnt1,,"GNU ttf2fnt","Konvertiert TTF Dateien in DOS bitmap fonts.","Mit TTF2FNT kînnen Sie .TTF-Dateien in DOS-Bitmap-Schriften konvertieren. (Anmerkung: Dies ist eine Win32 BenutzeroberflÑche).","gpl, ttf2fnt, WIN32, DOS, FreeDOS,ttf font, VGA bitmap","Win32, Delphi 3","GNU General Public License, Version 2",57ded615eb8d129f4111e9433edcdb13b089ab7a4ca7a7884b94bd69713e8bd6
udvd2,,udvd2,"CD/DVD UltraDMA Treiber.","CD/DVD UltraDMA GerÑtetreiber.","CD, DVD, driver, Treiber",DOS,"Free w/sources",f9eefd86a37904569e9a6dc3606a8837ab00cf6f811e222893f018837509367e
uhdd,,UHDD,Festplatten-/SSD-Caching-Treiber.,"UHDD ist ein Festplatten-/SSD-Caching-Treiber fÅr bis zu 10 BIOS-Festplatten auf bis zu 4 UltraDMA-Controllern. Es bietet auch Caching fÅr Festplatten, die von UDVD2 verwaltet werden, wenn es nach UHDD geladen wird.","Cache, Disk, driver, ide, sata, Treiber",DOS,"Free w/sources",0477c31bbcd7e45b60fb7faeeee6022866f69f4aa6c97e44901556a30541ad41
uhex,,uHex,"Einfacher und schneller Hex-Editor.","Uhex ist ein einfacher und schneller Hex-Editor.","hex,Editor,viewer",DOS,"Simplified (2-clause) BSD License",0332ba0b4bf5f1787eeb51610dfb2f783bc05235027f58021c1446d8580a39f5
uide,,UIDE,"Universeller Caching-Treiber fÅr DOS.","Ein universeller Caching-Treiber fÅr DOS-Laufwerke, Disketten, CD/DVD, SATA und UltraDMA-Festplatten.","ahci, cache, cc, cd, cd-rom, cdrom, disk, dma, driver, eide, floppy, ide, pata, rom, sata, sata, uhdd, uide, ultra",DOS,"Free w/sources",829ba21202d6a7e1e84856460df45556e8c24c23cb0c9bc316a4d4c8973a4972
umm,,UMM,"Registriert Hardware-UMB-Speicher als verfÅgbar.","Ermîglicht UMB (upper memory blocks), registriert Hardware-UMB-Speicher als verfÅgbar, erfordert 286+.","UMB, memory",DOS,"GNU General Public License, Version 2",0ec865e6f324fcbe05eb6e2d88154b515fc86d61f2c1a803cafdc0b018be9213
undelete,,Undelete,"Stellt gelîschte Dateien wieder her.","Ermîglicht das Wiederherstellen gelîschter (aber wiederherstellbarer) Dateien aus einem FAT16/FAT32-Dateisystem.","undelete, unerase, recovery","DOS, FreeDOS","GNU General Public License, Version 2",3258e7d5f8fa7aca7178167494ec4fc888ce2fae6084b4ca779dca3a0960e7ae
unformat,,UNFORMAT,"Macht das Formatieren von HDs rÅckgÑngig.","Macht das versehentliche Formatieren eines DatentrÑgers/einer Partition rÅckgÑngig.","format, unformat, harddrive,","DOS, FreeDOS","GNU General Public License",1ff8a2f77ed349bb73221037ea0d79d60e4b69873d8399f5dd7037005a1e98d9
unrar,,UnRAR,"Ein RAR Extraktionsprogramm.","Ein RAR Extraktionsprogramm mit hoher Dekomprimierungsrate.","UnRAR, RAR, decompressor, archive, Archiv",DOS,"Freeware, see License.txt",38db894d9ac2c562b3679eaec32f3ad727828c090b2510050f5b9d5e3340e2e2
unrtf,,UnRTF,"Konvertiert RTF Dokumente in andere Formate..","Konvertiert Dokumente im RTF-Format in andere Formate (html, latex, txt, ?).",rtf,DOS,"GNU General Public License, Version 3",d9315cc66494a80a83b604608dfa4c298d479f18d09bfeaf47a86a46ed26d560
unzip,,UnZip,"Ein Dekompressionstool Ñhnlich PKUNZIP.","Ein Dekompressionstool Ñhnlich PKUNZIP.","FreeDOS, unzip, infozip, pkunzip","DOS, UNIX, MAC","Open Source, see License",00227e5b6f6b7d168973b1355ff74402d3785c89b68675fbd1c72dac2d436729
uptime,,uptime,"Zeigt die Uptime (Betriebszeit) an.","Zeigt die Uptime (Betriebszeit) an, sogar in DOSEMU. éhnlich dem UNIX-Tool 'uptime'.",uptime,"DOS, FreeDOS","Source Code Available (open)",b1d45ae900ba8a31e78b58a22c86e0c64b15727cb457970e2212e843c365bd84
uptimec,,"Uptime (Chamorro)","Zeigt die Systembetriebszeit an.","Meldet die Systembetriebszeit, indem es automatisch erkennt, wann es zum ersten Mal gestartet wurde. Es repliziert *NIX uptime, einen der grundlegenden UNIX-Befehle, mit dem Sie schnell bestÑtigen kînnen, wie lange Ihr System seit dem letzten Neustart oder Einschalten betriebsbereit war.",uptime,"DOS, FreeDOS","GNU Lesser General Public License, Version 3",2142e0f877e3ec69e6342ed2cbca2b74f6c8e462d03b241ca0d373d1ea9077b6
upx,,UPX,"AusfÅhrbarer High-Performance Packer.","UPX ist ein freier, portabler, erweiterbarer, leistungsstarker ausfÅhrbarer Packer fÅr verschiedene ausfÅhrbare Formate.","executable packer",DOS,"GNU General Public License, Version 2",332ec4efc0d378cf58b62e37d5414ba3842563e43c4ef07c9d56e637edb81bb4
urthwurm,,UrthWurm,"FÅhre einen Wurm durch 10 Hîhlenlevels.","FÅhre einen Wurm durch 10 Levels von Hîhlen (Remake von SFCave).","SFCave, Urthwurm",DOS,"Free w/Sources",271a398f5db429ac4fedd5b11a2b0dd06b44acae6524bcd74a39504545ffa2ec
